name,shortDescription     ,longDescription ,requiredSkills  ,expertiseLevel       ,durationEstimateDays,tags,complexityScore
Responsive Portfolio Website with Animations,Build a responsive personal portfolio website with modern UI and smooth animations using component-based architecture and utility-first styling,"Create a fully responsive portfolio site featuring sections for hero, about, projects, and contact. Implement reusable React components, Tailwind CSS for styling, and Framer Motion for page and element animations. Focus on layout, responsiveness, and clean UI without backend integration","Next.js|React|JavaScript|Tailwind CSS|HTML5|CSS3|Framer Motion,frontend|portfolio|ui|animations",beginner,6-10 hours ,frontend|portfolio|ui|animations,3
Landing Page Builder with Reusable Components,Design a marketing landing page using reusable components and consistent design patterns.,"Develop a modern landing page with multiple sections such as hero, features, testimonials, and CTA. Emphasize reusable React components, responsive layouts with Tailwind CSS, and basic animations. Learn project structuring and component reusability","Next.js|React|JavaScript|Tailwind CSS|HTML5|CSS3|Framer Motion,frontend|landing-page|components|responsive",beginner,3-5 hours ,frontend|landing-page|components|responsive,3
Theme Toggle Dashboard UI,Create a dashboard interface with light and dark theme switching.,"Build a simple dashboard layout that supports light and dark themes using state management. Implement theme persistence in the browser and responsive UI components. Focus on UI logic, state handling, and clean styling practices.","Next.js|React|JavaScript|Tailwind CSS|HTML5|CSS3|Zustand,frontend|dashboard|theme|state-management",beginner,3-5 hours ,frontend|dashboard|theme|state,3
Animated Blog Listing Page,Build a blog listing UI with animated cards and navigation,Create a blog-style interface displaying a list of articles using card components. Add hover and entry animations with Framer Motion and responsive grid layouts. Emphasize clean component structure and UI transitions.,"Next.js|React|JavaScript|Tailwind CSS|HTML5|CSS3|Framer Motion,frontend|blog|animations|ui",beginner,6-10 hours ,frontend|blog|ui|animations,4
Interactive Pricing Page UI,Design an interactive pricing page with toggles and highlights,"Develop a pricing page featuring multiple plans, a monthly yearly toggle, and highlighted popular plans. Use React state for interactions and Tailwind CSS for layout and responsiveness. Focus on UI logic and presentation","Next.js|React|JavaScript|Tailwind CSS|HTML5|CSS3,frontend|pricing|ui|interaction",beginner,3-5 hours ,frontend|pricing|ui|interaction,3
Form Validation UI with Modern Styling,Create a styled form interface with client-side validation,"Build a contact or signup form with input validation and error handling. Use controlled components in React and Tailwind CSS for styling. Focus on form UX, accessibility basics, and clean UI feedback.","Next.js|React|JavaScript|Tailwind CSS|HTML5|CSS3,frontend|forms|validation|ui",beginner,6-10 hours ,frontend|forms|validation|ui,4
Static E-commerce Product Page,Design a product detail page similar to an e-commerce website.,"Create a product page featuring image gallery layout, product details, pricing, and action buttons. Emphasize responsive design, reusable UI components, and clean styling without backend logic.","Next.js|React|JavaScript|Tailwind CSS|HTML5|CSS3,frontend|ecommerce|product-page|ui",beginner,6-10 hours ,frontend|ecommerce|product|ui,4
Navigation Menu and Layout System,Build a responsive navigation bar and layout system.,"Develop a reusable navigation bar with mobile menu support and a consistent layout wrapper. Focus on responsive behavior, accessibility basics, and clean component structure using Tailwind CSS","Next.js|React|JavaScript|Tailwind CSS|HTML5|CSS3,frontend|navigation|layout|responsive",beginner,1-2 hours ,frontend|navigation|layout|responsive,2
Animated Testimonials Section,Create an animated testimonials section for marketing sites.,Build a testimonials carousel or grid with subtle animations and transitions. Use Framer Motion for entry effects and Tailwind CSS for layout. Focus on UI polish and animation timing.,Next.js|React|JavaScript|Tailwind CSS|HTML5|CSS3|Framer,beginner,6-10 hours ,frontend|testimonials|ui|animations,3
404 and Error Pages Collection,Design custom 404 and error pages with animations.,"Create a set of custom error pages including 404 and generic error states. Use creative layouts, responsive design, and simple animations to enhance user experience.","Next.js|React|JavaScript|Tailwind CSS|HTML5|CSS3|Framer Motion,frontend|error-pages|ui|animations",beginner,6-10 hours ,frontend|error-pages|ui|static,2
Responsive Personal Portfolio UI,Create a clean responsive personal portfolio interface with modern styling.,Build a responsive portfolio with sections for hero about projects and contact. Use reusable React components Tailwind CSS for layout and Framer Motion for subtle animations. Focus on accessibility responsiveness and clean component structure.,"Next.js|React|JavaScript|Tailwind CSS|HTML5|CSS3|Framer Motion,frontend|portfolio|responsive|ui",beginner,3-5 hours ,frontend|portfolio|responsive|ui,3
Landing Page Component System,Design a modular landing page using reusable UI components.,Create a marketing landing page with hero features testimonials and call to action. Emphasize component reusability responsive grids and smooth motion effects using Framer Motion.,"Next.js|React|JavaScript|Tailwind CSS|HTML5|CSS3|Framer Motion,frontend|landing|components|ui",beginner,3-5 hours ,frontend|landing-page|design-system|components,4
Animated Blog Cards Grid,Create an animated grid of blog cards.,Design a blog listing UI with card components hover effects and entrance animations. Use responsive grids and motion timing for polished UI transitions,"Next.js|React|JavaScript|Tailwind CSS|HTML5|CSS3|Framer Motion,frontend|blog|cards|animations",beginner,3-5 hours ,frontend|blog|cards|animations,3
Interactive Pricing Section UI,Build an interactive pricing section with plan toggles.,Create a pricing UI with monthly yearly toggle plan highlights and responsive layout. Use React state and Tailwind utilities for interaction and presentation.,"Next.js|React|JavaScript|Tailwind CSS|HTML5|CSS3,frontend|pricing|interaction|ui",beginner,6-10 hours ,frontend|pricing|toggle|ui,3
Form UI with Client Validation,Design a modern form UI with validation feedback.,Build a contact or signup form using controlled inputs validation messages and accessible labels. Focus on UX clarity and responsive styling.,"Next.js|React|JavaScript|Tailwind CSS|HTML5|CSS3,frontend|forms|validation|ux",beginner,3-5 hours ,frontend|forms|validation|ux,3
Ecommerce Product Detail UI,Create a product detail interface for ecommerce.,Design a product page with image gallery product info pricing and action buttons. Emphasize responsive layout reusable components and clean UI.,"Next.js|React|JavaScript|Tailwind CSS|HTML5|CSS3,frontend|ecommerce|product|ui",beginner,3-5 hours ,frontend|ecommerce|product-detail|ui,4
Responsive Navigation and Layout,uild a responsive navigation bar and layout shell.,Create a mobile friendly navigation with dropdown menu and a reusable page layout. Focus on accessibility responsiveness and clean component design.,"Next.js|React|JavaScript|Tailwind CSS|HTML5|CSS3,frontend|navigation|layout|responsive",beginner,1-2 hours ,frontend|navigation|layout|responsive,3
Animated Testimonials Carousel,Design an animated testimonials section.,Create a testimonials carousel or grid with smooth transitions using motion components. Focus on animation polish spacing and typography.,"Next.js|React|JavaScript|Tailwind CSS|HTML5|CSS3|Framer Motion,frontend|testimonials|animations|ui",beginner,10+ hours ,frontend|testimonials|carousel|animations,3
Custom 404 and Error Pages UI,Create custom error pages with creative layouts.,"Design custom 404 and error state pages with responsive design and subtle animations to enhance user experience.,","Next.js|React|JavaScript|Tailwind CSS|HTML5|CSS3|Framer Motion,frontend|error|pages|ui",beginner,10+ hours ,frontend|error-pages|ui|design,2
Advanced Portfolio Builder with CMS Like Sections,Create a dynamic portfolio UI with configurable sections and layouts,Build an advanced portfolio interface with dynamic section rendering reusable layout blocks and animated transitions using Framer Motion and strong component composition with TypeScript and React,"Next.js|React|TypeScript|Tailwind CSS|HTML5|CSS3|Framer Motion,frontend|portfolio|dynamic|ui",intermediate,6-10 hours ,frontend|portfolio|dynamic|advanced,6
Dashboard UI with Global State Management,Design a complex dashboard interface using global state patterns,Build a multi section dashboard UI with widgets charts placeholders and shared state using Zustand or Redux Toolkit focusing on scalable frontend architecture and UI consistency,"Next.js|React|TypeScript|Tailwind CSS|HTML5|CSS3|Zustand|Redux Toolkit,frontend|dashboard|state-management|architecture",intermediate,10+ hours ,frontend|dashboard|state-management|architecture,7
Authenticated Frontend Pages Flow,Create frontend pages with authentication aware UI states,Implement login signup and protected page layouts with conditional rendering based on authentication state using NextAuth.js and focus on frontend routing guards and UI flows,"Next.js|React|TypeScript|Tailwind CSS|HTML5|CSS3|NextAuth.js,frontend|auth|routing|ui",intermediate,6-10 hours ,frontend|auth|routing|protected-pages,6
Data Driven UI with Server Actions,Build frontend pages powered by server driven data flows,Create interactive frontend pages that fetch and mutate data using Next.js Server Actions and client components focusing on loading states error handling and UI feedback,"Next.js|React|TypeScript|Tailwind CSS|HTML5|CSS3|Next.js Server Actions,frontend|data|server-actions|ui",intermediate,10+ hours ,frontend|server-actions|data|async,7
Reusable Component Library System,Design a scalable reusable component library,Build a custom component system including buttons modals forms and layout primitives with consistent styling and documentation mindset using React and Tailwind CSS,"Next.js|React|TypeScript|Tailwind CSS|HTML5|CSS3,frontend|components|design-system|ui",intermediate,10+ hours ,frontend|components|design-system|scalable,6
Complex Forms with State and Validation,Create complex multi step forms with strong UX,"Implement multi step form flows with shared state validation feedback and animated transitions focusing on frontend logic and usability best practices,","Next.js|React|TypeScript|Tailwind CSS|HTML5|CSS3|Framer Motion,frontend|forms|ux|state",intermediate,10+ hours ,frontend|forms|multi-step|state,7
Frontend Data Fetching with Query Patterns,Build frontend screens using modern data fetching patterns,Create UI pages that consume mock APIs using TanStack Query with caching loading and error states focusing on clean separation between data and presentation layers,"Next.js|React|TypeScript|Tailwind CSS|HTML5|CSS3|TanStack Query,frontend|data-fetching|state|ui",intermediate,6-10 hours ,frontend|data-fetching|cache|ui,7
Interactive Analytics Dashboard UI,Design an analytics style dashboard with advanced interactions,Build a responsive analytics dashboard UI with filters tabs and interactive cards focusing on information hierarchy UI performance and reusable layout patterns,"Next.js|React|TypeScript|Tailwind CSS|HTML5|CSS3,frontend|analytics|dashboard|ui",intermediate,6-10 hours ,frontend|analytics|dashboard|visualization,8
Animated Multi Page Marketing Website,Create a multi page marketing site with rich animations,Develop a marketing website with page transitions scroll based animations and shared layout components using Framer Motion and Next.js routing,"Next.js|React|TypeScript|Tailwind CSS|HTML5|CSS3|Framer Motion,frontend|marketing|animations|website",intermediate,3-5 hours ,frontend|marketing|animations|multi-page,6
Frontend Testing for UI Components,Add automated tests for frontend components,Write unit and interaction tests for UI components and pages using Jest and Playwright focusing on reliability regression prevention and frontend quality practices,"Next.js|React|TypeScript|Tailwind CSS|HTML5|CSS3|Jest|Playwright,frontend|testing|quality|ui",intermediate,3-5 hours ,frontend|testing|ui|quality,6
RESTful API for Task Management,Build a simple REST API to manage tasks with basic CRUD operations.,Create a backend service that allows users to create read update and delete tasks. Focus on API design routing controllers and basic request validation using Node.js and Express.js with clear separation of concerns,"Node.js|Express.js|REST API|Git|GitHub,backend|api|crud|tasks",beginner,6-10 hours ,backend|api|crud|rest,3
User Authentication API Basics,Implement a basic authentication system using tokens,Build an authentication API with user registration login and protected routes using JWT. Focus on request handling token generation middleware usage and secure API patterns.,"Node.js|Express.js|JWT|REST API|Git|GitHub,backend|authentication|security|api",beginner,6-10 hours ,backend|auth|jwt|security,4
Simple API with MongoDB Integration,Create a backend API connected to a NoSQL database,Develop a REST API that stores and retrieves data from MongoDB. Learn basic schema design database connections and CRUD operations using Express.js.,"Node.js|Express.js|MongoDB|REST API|Git|GitHub,backend|database|mongodb|api",beginner,6-10 hours ,backend|mongodb|database|api,4
PostgreSQL CRUD API with Prisma,Build a relational database backed API using Prisma.,"Create a backend service that performs CRUD operations on PostgreSQL using Prisma ORM. Focus on schema modeling migrations and clean data access patterns.,","Node.js|Express.js|PostgreSQL|Prisma ORM|REST API|Git|GitHub,backend|postgresql|prisma|api",beginner,3-5 hours ,backend|postgresql|prisma|database,5
Backend API with Supabase Auth,Integrate Supabase authentication in a backend service,Build an API that uses Supabase for user authentication and data storage. Focus on secure API routes token verification and basic data operations,"Node.js|Express.js|Supabase|REST API|Git|GitHub,backend|supabase|auth|api",beginner,3-5 hours ,backend|supabase|auth|backend,4
Simple GraphQL API Server,Create a basic GraphQL API with queries and mutations,Develop a beginner friendly GraphQL server that supports simple queries and mutations. Learn schema definition resolvers and request handling fundamentals.,"Node.js|Express.js|GraphQL|Git|GitHub,backend|graphql|api|server",beginner,10+ hours ,backend|graphql|schema|api,4
Backend API with Firebase Database,Build a backend service using Firebase as database,Create an API that reads and writes data to Firebase. Focus on service setup authentication basics and structured data access.,"Node.js|Express.js|Firebase|REST API|Git|GitHub,backend|firebase|database|api",beginner,3-5 hours ,backend|firebase|database|api,3
Basic Real Time Chat Backend,Implement a simple real time messaging backend.,Build a backend service that supports real time chat using Socket.IO. Focus on event handling connections and message broadcasting,"Node.js|Express.js|Socket.IO|WebSockets|Git|GitHub,backend|realtime|chat|websockets",beginner,6-10 hours ,backend|realtime|chat|websockets,6
Backend API with Input Validation and Linting,Create a clean API with validation and code quality tools.,Develop a REST API that includes request validation ESLint and Prettier setup. Focus on maintainable backend structure and clean code practices,"Node.js|Express.js|REST API|ESLint|Prettier|Git|GitHub,backend|validation|quality|api",beginner,10+ hours ,backend|validation|linting|quality,3
Dockerized Backend API Starter,Containerize a simple backend API for deployment,Create a beginner friendly backend service packaged with Docker. Learn container basics environment configuration and running APIs consistently across environments,"Node.js|Express.js|Docker|REST API|Git|GitHub,backend|docker|deployment|api",beginner,10+ hours ,backend|docker|deployment|backend,5
Scalable REST API with Layered Architecture,Design a scalable REST API using clean layered architecture,Build a modular backend with controllers services and repositories focusing on separation of concerns error handling and scalable structure using Express.js and Node.js,"Node.js|Express.js|REST API|Git|GitHub,backend|architecture|rest|scalable",intermediate,10+ hours ,backend|architecture|scalable|rest,7
Authentication and Authorization System,Implement secure authentication and role based authorization,Create an API with login registration JWT based auth and role based access control focusing on middleware design token handling and protected,"Node.js|Express.js|JWT|OAuth|REST API|Git|GitHub,backend|auth|security|roles",intermediate,10+ hours ,backend|auth|roles|authorization,7
GraphQL API with Real World Schema Design,Build a structured GraphQL API with advanced schema design,Design a GraphQL server with nested types queries and mutations focusing on resolver structure input validation and performance basics,"Node.js|Express.js|GraphQL|Git|GitHub,backend|graphql|schema|api",intermediate,10+ hours ,backend|graphql|schema|advanced,7
Database Driven API with Prisma ORM,Create a production ready API using Prisma ORM,Build an API backed by PostgreSQL using Prisma ORM focusing on relational modeling migrations transactions and clean data access patterns,"Node.js|Express.js|PostgreSQL|Prisma ORM|REST API|Git|GitHub,backend|prisma|database|api",intermediate,10+ hours ,backend|database|prisma|relations,8
Supabase Powered Backend Service,Develop a backend service using Supabase features,Create APIs using Supabase authentication database and storage focusing on secure access policies and scalable backend logic,"Node.js|Express.js|Supabase|REST API|Git|GitHub,backend|supabase|backend|auth",intermediate,10+ hours ,backend|supabase|backend|secure,7
Real Time Collaboration Backend,Build a real time backend for collaborative features,mplement a backend supporting live updates using WebSockets and Socket.IO focusing on rooms events and real time data flow,"Node.js|Express.js|Socket.IO|WebSockets|Git|GitHub,backend|realtime|collaboration|websockets",intermediate,10+ hours ,backend|realtime|collaboration|sockets,8
API with Advanced Validation and Error Handling,Create a robust API with validation and global errors,Build an API with structured validation centralized error handling and consistent response formats focusing on reliability and maintainability,"Node.js|Express.js|REST API|ESLint|Prettier|Git|GitHub,backend|validation|errors|api",intermediate,6-10 hours ,backend|error-handling|validation|api,6
Secure API with OAuth Integration,Integrate third party login using OAuth flows,Integrate third party login using OAuth flows,"Node.js|Express.js|OAuth|REST API|Git|GitHub,backend|oauth|security|api",intermediate,10+ hours ,backend|oauth|security|integration,7
Containerized Backend with Docker and CI Basics,Prepare a backend service for containerized deployment,Containerize a backend API using Docker and configure environment based setups focusing on production readiness and deployment workflows,"Node.js|Express.js|Docker|REST API|Git|GitHub,backend|docker|deployment|backend",intermediate,6-10 hours ,backend|docker|ci|deployment,7
Backend Testing and Quality Assurance,mplement automated tests for backend APIs,Write unit and integration tests for backend endpoints using Jest focusing on testable architecture reliability and regression prevention,"Node.js|Express.js|REST API|Jest|Git|GitHub,backend|testing|quality|api",intermediate,10+ hours ,backend|testing|api|quality,7
Full Stack Task Management Platform,Build a full stack task manager with authenticated users,Create a full stack application where users can register login and manage tasks with CRUD operations using REST APIs server side logic and responsive frontend pages with state management and clean UI,"Next.js|React|TypeScript|Tailwind CSS|Node.js|Express.js|REST API|JWT|Git|GitHub,fullstack|tasks|auth|crud",intermediate,10+ hours ,fullstack|tasks|crud|auth,6
Authenticated Blog Platform,Create a blog platform with authentication and content management,Build a full stack blog system where users can sign up log in create edit and delete posts with protected routes backend APIs and a responsive frontend dashboard,"Next.js|React|TypeScript|Tailwind CSS|Node.js|Express.js|REST API|JWT|Git|GitHub,fullstack|blog|auth|content",intermediate,10+ hours ,fullstack|blog|auth|content,7
User Dashboard with Data Persistence,Develop a user dashboard with persistent backend data,"Create a full stack dashboard that displays user specific data fetched from backend APIs with secure authentication state management and responsive UI components,intermediate","Next.js|React|TypeScript|Tailwind CSS|Node.js|Express.js|REST API|Zustand|JWT|Git|GitHub,fullstack|dashboard|state|backend",intermediate,10+ hours ,fullstack|dashboard|state|backend,7
Full Stack App with PostgreSQL and Prisma,Build a data driven app using relational database,Develop a full stack application with PostgreSQL database using Prisma ORM backend APIs and frontend pages for managing relational data securely and efficiently,"Next.js|React|TypeScript|Tailwind CSS|Node.js|Express.js|PostgreSQL|Prisma ORM|REST API|Git|GitHub,fullstack|postgresql|prisma|database",intermediate,10+ hours ,fullstack|database|prisma|fullstack,8
Supabase Powered Full Stack Application,Create a full stack app using Supabase services,Build an application using Supabase for authentication and database with frontend pages backend logic and secure access patterns focusing on real world workflows,"Next.js|React|TypeScript|Tailwind CSS|Supabase|REST API|Git|GitHub,fullstack|supabase|auth|backend",intermediate,10+ hours ,fullstack|supabase|auth|fullstack,7
Real Time Chat Application,Develop a real time chat app with frontend and backend,Create a full stack chat application supporting real time messaging using WebSockets with user authentication message persistence and responsive chat UI,"Next.js|React|TypeScript|Tailwind CSS|Node.js|Express.js|Socket.IO|WebSockets|JWT|Git|GitHub,fullstack|realtime|chat|websockets",intermediate,10+ hours ,fullstack|realtime|chat|websockets,8
GraphQL Based Full Stack App,Build a full stack application using GraphQL APIs,Develop a frontend consuming GraphQL queries and mutations with a Node.js backend GraphQL server focusing on schema design data flow and UI integration,"Next.js|React|TypeScript|Tailwind CSS|Node.js|Express.js|GraphQL|Git|GitHub,fullstack|graphql|api|frontend",intermediate,10+ hours ,fullstack|graphql|api|frontend,8
AI Powered Content Generator App,Create a full stack AI powered content generation app,Build an application that uses OpenAI API to generate content with secure backend endpoints and a clean frontend interface handling user input and results,"Next.js|React|TypeScript|Tailwind CSS|Node.js|Express.js|OpenAI API|REST API|Git|GitHub,fullstack|ai|content|generator",intermediate,10+ hours ,fullstack|ai|content|generation,8
Authentication System with OAuth Integration,Implement OAuth based login in a full stack app,Create a full stack application with OAuth login flow backend token handling and frontend protected pages focusing on security and user experience,"Next.js|React|TypeScript|Tailwind CSS|Node.js|Express.js|OAuth|JWT|REST API|Git|GitHub,fullstack|oauth|auth|security",intermediate,10+ hours ,fullstack|oauth|auth|security,8
Production Ready Full Stack App with Docker,Prepare a full stack app for production deployment,Build a complete application with frontend backend containerized using Docker including environment configuration and deployment ready setup,"Next.js|React|TypeScript|Tailwind CSS|Node.js|Express.js|Docker|REST API|Git|GitHub,fullstack|docker|deployment|production",intermediate,10+ hours ,fullstack|docker|production|deployment,9
Enterprise AI Content Generation Platform,Build a scalable AI powered content generation system,Develop a production grade platform that allows authenticated users to generate long form content using OpenAI API or Anthropic API with secure backend orchestration prompt management rate limiting and a responsive frontend dashboard,"Next.js|React|TypeScript|Tailwind CSS|Node.js|Express.js|OpenAI API|Anthropic API|REST API|JWT|Git|GitHub,ai|content-generation|llm|platform",advanced,10+ hours ,ai|llm|content|platform,9
AI Driven Resume and Portfolio Analyzer,Create an AI system that analyzes resumes and portfolios,Build a full stack application where users upload resume data and receive AI generated feedback scoring and improvement suggestions using LLMs with structured prompts and frontend visualization,"Next.js|React|TypeScript|Tailwind CSS|Node.js|Express.js|OpenAI API|REST API|JWT|Git|GitHub,ai|resume|analysis|llm",advanced,10+ hours ,ai|analysis|resume|llm,10
AI Chat Application with Context Memory,Develop an AI chat system with conversation memory,Create an advanced chat application that maintains contextual memory across sessions using backend state handling prompt chaining and real time UI updates for a conversational AI experience,"Next.js|React|TypeScript|Tailwind CSS|Node.js|Express.js|OpenAI API|Socket.IO|WebSockets|JWT|Git|GitHub,ai|chat|memory|realtime",advanced,10+ hours ,ai|chat|memory|llm,9
