name,shortDescription     ,longDescription ,requiredSkills  ,expertiseLevel       ,durationEstimateDays,tags,complexityScore
AI Powered Customer Support Assistant,Build an AI assistant for customer support workflows,Develop an AI driven support system that answers user queries routes tickets and generates suggested replies using structured prompts backend orchestration and a role based admin dashboard,"Next.js|React|TypeScript|Tailwind CSS|Node.js|Express.js|OpenAI API|REST API|JWT|Git|GitHub,ai|support|assistant|automation",advanced,10+ hours ,ai|support|automation|ai,8
AI Based Project Recommendation Engine,Create an AI engine that recommends projects to users,Build a system that analyzes user skills history and goals to generate personalized project recommendations using LLM reasoning and structured data pipelines with frontend insights,"Next.js|React|TypeScript|Tailwind CSS|Node.js|Express.js|OpenAI API|REST API|Git|GitHub,ai|recommendation|personalization|llm",advanced,10+ hours ,ai|recommendation|personalization|llm,9
Multi Model AI Prompt Orchestration System,Design a platform that orchestrates multiple AI models,Create an advanced backend system that dynamically routes prompts between OpenAI API and Anthropic API with fallback logic evaluation metrics and configurable prompt templates exposed via APIs,"Node.js|Express.js|TypeScript|OpenAI API|Anthropic API|REST API|Git|GitHub,ai|prompt-engineering|orchestration|llm",advanced,10+ hours ,ai|prompt|orchestration|multi-model,8
AI Enhanced Learning Path Generator,Build an AI system that generates learning paths,Develop a platform that creates personalized learning roadmaps based on user input skill gaps and goals using LLM reasoning backend workflows and a structured frontend experience,"Next.js|React|TypeScript|Tailwind CSS|Node.js|Express.js|OpenAI API|REST API|Git|GitHub,ai|learning|roadmap|education",advanced,10+ hours ,ai|learning|roadmap|ai,9
AI Powered Interview Simulation Platform,Create an AI based interview simulation system,Build a system that simulates technical interviews with dynamic questioning evaluation and feedback using AI models with session management and a responsive interview UI,"Next.js|React|TypeScript|Tailwind CSS|Node.js|Express.js|OpenAI API|Socket.IO|WebSockets|JWT|Git|GitHub,ai|interview|simulation|assessment",advanced,10+ hours ,ai|interview|simulation|assessment,9
Real Time AI Collaboration Assistant,Develop an AI assistant that collaborates in real time,"Create a collaborative environment where AI participates in discussions suggests ideas and summarizes conversations in real time using WebSockets and LLM integration,","Next.js|React|TypeScript|Tailwind CSS|Node.js|Express.js|OpenAI API|Socket.IO|WebSockets|Git|GitHub,ai|collaboration|assistant|realtime",advanced,10+ hours ,ai|collaboration|realtime|ai,10
AI Workflow Automation Platform,Build an AI driven workflow automation system,Develop a platform that uses AI to automate task flows decision making and content generation across multiple steps with backend orchestration secure APIs and an admin controlled frontend,"Next.js|React|TypeScript|Tailwind CSS|Node.js|Express.js|OpenAI API|REST API|JWT|Git|GitHub,ai|automation|workflow|platform",advanced,10+ hours ,ai|automation|workflow|platform,9
Real Time Collaboration Workspace,Build a multi user real time collaboration platform,Develop a workspace where multiple users collaborate with live updates presence indicators and synchronized state using WebSockets Socket.IO secure authentication and scalable backend architecture,"Next.js|React|TypeScript|Tailwind CSS|Node.js|Express.js|Socket.IO|WebSockets|JWT|Git|GitHub,realtime|collaboration|presence|sync",advanced,10+ hours ,realtime|collaboration|workspace|sync,9
Real Time Chat Platform with Scalable Rooms,Create a production grade real time chat system,Build a chat platform supporting private and group rooms message persistence typing indicators and user presence using Socket.IO with robust backend event handling,"Next.js|React|TypeScript|Tailwind CSS|Node.js|Express.js|Socket.IO|WebSockets|JWT|Git|GitHub,realtime|chat|rooms|messaging",advanced,10+ hours ,realtime|chat|rooms|scalable,8
Live Notification and Event Streaming System,Design a real time notification delivery system,Create a backend driven live notification system that pushes events instantly to connected clients with delivery guarantees reconnection logic and frontend state synchronization,"Next.js|React|TypeScript|Tailwind CSS|Node.js|Express.js|WebSockets|JWT|Git|GitHub,realtime|notifications|events|streaming",advanced,10+ hours ,realtime|notifications|events|streaming,9
Real Time Multiplayer Game Backend,Build a real time multiplayer game server,Develop a backend that manages player connections game state synchronization matchmaking and real time updates using WebSockets with performance focused architecture,"Node.js|Express.js|TypeScript|Socket.IO|WebSockets|Git|GitHub,realtime|multiplayer|game|state",advanced,10+ hours ,realtime|multiplayer|game|state,8
Live Dashboard with Streaming Data,Create a dashboard with real time data streaming,Build a system that streams live metrics and updates dashboards instantly with efficient state updates and scalable socket management,"Next.js|React|TypeScript|Tailwind CSS|Node.js|Express.js|WebSockets|Git|GitHub,realtime|dashboard|streaming|metrics",advanced,10+ hours ,realtime|dashboard|streaming|metrics,9
Collaborative Real Time Whiteboard,Develop a shared real time whiteboard application,Create a collaborative drawing whiteboard with real time cursor tracking synchronized canvas updates and multi user interactions using Socket.IO,"Next.js|React|TypeScript|Tailwind CSS|Node.js|Express.js|Socket.IO|WebSockets|Git|GitHub,realtime|whiteboard|collaboration|canvas",advanced,10+ hours ,realtime|whiteboard|collaboration|canvas,8
Real Time Voting and Polling Platform,Build a live voting and polling system,Develop a platform that supports live polls instant result updates and high concurrency using WebSockets and efficient backend broadcasting logic,"Next.js|React|TypeScript|Tailwind CSS|Node.js|Express.js|WebSockets|Git|GitHub,realtime|polling|voting|live",advanced,10+ hours ,realtime|polling|voting|live,8
Live Customer Support Chat System,Create a real time customer support chat application,Build a support system where agents and users communicate live with routing queues presence tracking and secure sessions using Socket.IO,"Next.js|React|TypeScript|Tailwind CSS|Node.js|Express.js|Socket.IO|WebSockets|JWT|Git|GitHub,realtime|support|chat|customers",advanced,10+ hours ,realtime|support|chat|customers,9
Real Time Collaborative Code Editor,Develop a collaborative code editing platform,Create a code editor that supports real time multi user editing cursor sync and conflict handling using WebSockets and operational logic on the backend,"Next.js|React|TypeScript|Tailwind CSS|Node.js|Express.js|WebSockets|Git|GitHub,realtime|code-editor|collaboration|sync",advanced,10+ hours ,realtime|code-editor|collaboration|sync,9
Event Driven Real Time Analytics Engine,Build a real time analytics processing system,Develop an event driven system that processes streams in real time and updates connected clients instantly focusing on performance scalability and data flow consistency,"Node.js|Express.js|TypeScript|WebSockets|Git|GitHub,realtime|analytics|events|stream",advanced,10+ hours ,realtime|analytics|events|stream,10